WebsiteAccessCategoryID,AccessType,Description,AccessLevel,LastLoginDate,AccountStatus,DateCreated,UserRole,Permissions,MultiFactorEnabled,SubscriptionPlan,CustomerID
187,Guest,Interesting number us wide glass support.,High,2024-01-04,Inactive,2022-01-17,Manager,"['mouth', 'represent', 'everybody']",False,Enterprise,8
188,Guest,Candidate need study west food thing.,High,2024-06-20,Inactive,2023-07-15,Seller,"['writer', 'mother', 'view']",True,Premium,1
189,Guest,Thus anything door hotel kid.,Low,2024-06-22,Suspended,2020-11-11,Manager,"['what', 'book', 'song']",True,Basic,8
190,Admin,Note be drop story home easy with.,High,2024-07-06,Active,2020-12-14,Buyer,"['sound', 'each', 'newspaper']",True,Basic,7
191,Admin,Weight leg discussion need.,Low,2024-07-07,Inactive,2021-02-16,Buyer,"['stay', 'great', 'scene']",True,Enterprise,5
192,User,Race within both authority red drop already.,Low,2024-05-28,Active,2020-06-25,Buyer,"['quickly', 'policy', 'remember']",False,Enterprise,7
193,Guest,Street offer wind herself sport.,Medium,2024-05-29,Inactive,2024-04-16,Manager,"['truth', 'let', 'natural']",False,Basic,10
194,Guest,Rather home store field.,Low,2024-04-03,Inactive,2020-08-06,Buyer,"['drive', 'do', 'realize']",False,Basic,3
195,Guest,Least model rest learn organization everyone something course.,Low,2024-06-02,Suspended,2023-11-06,Buyer,"['young', 'that', 'throw']",True,Enterprise,2
196,User,Question girl hear us.,Low,2024-08-08,Inactive,2021-05-20,Seller,"['low', 'quality', 'decide']",False,Premium,8
197,Guest,Former dream necessary eight student.,Low,2024-03-06,Inactive,2024-05-23,Buyer,"['edge', 'conference', 'Republican']",True,Premium,7
198,Admin,Not lot glass well.,Low,2024-07-08,Suspended,2023-06-22,Manager,"['reveal', 'she', 'simply']",False,Basic,7
199,User,Sort stand choice somebody.,Low,2024-03-12,Active,2020-06-22,Buyer,"['billion', 'no', 'wide']",False,Premium,6
200,Admin,Health end site.,Medium,2024-07-04,Inactive,2020-10-18,Seller,"['agree', 'hour', 'break']",False,Premium,2
