WebsiteAccessCategoryID,AccessType,Description,AccessLevel,LastLoginDate,AccountStatus,DateCreated,UserRole,Permissions,MultiFactorEnabled,SubscriptionPlan,CustomerID
1,Admin,Method because according maintain woman month southern.,Low,2024-06-05,Suspended,2022-12-20,Manager,"['sense', 'staff', 'property']",False,Basic,2
2,Admin,Art thing eye mention by billion show anyone.,Low,2024-05-04,Active,2024-05-07,Buyer,"['everybody', 'nice', 'ten']",True,Enterprise,9
3,User,Develop skin senior throw detail fight group.,Medium,2024-04-16,Inactive,2021-02-10,Seller,"['hot', 'cover', 'subject']",True,Premium,7
4,User,Hear nearly hotel administration year.,Low,2024-07-27,Active,2020-09-04,Manager,"['room', 'game', 'free']",True,Premium,2
5,Guest,Take surface put there dog little.,Low,2024-06-08,Active,2020-05-19,Buyer,"['sure', 'politics', 'remain']",False,Premium,7
6,Guest,Them civil experience leader left full.,Medium,2024-07-08,Active,2024-04-28,Manager,"['tend', 'stuff', 'especially']",True,Enterprise,3
7,Admin,Reduce for realize customer despite air nation.,Medium,2024-04-12,Inactive,2020-06-15,Manager,"['white', 'weight', 'study']",False,Enterprise,2
8,Guest,Imagine huge as nature arrive bar.,High,2024-07-23,Active,2024-02-26,Buyer,"['religious', 'commercial', 'down']",False,Premium,1
9,Admin,Fill run these right foreign large her.,Low,2024-03-21,Inactive,2021-06-14,Manager,"['whatever', 'real', 'over']",True,Basic,6
10,Admin,Blue term key.,High,2024-08-13,Suspended,2022-02-26,Buyer,"['machine', 'others', 'worker']",False,Basic,5
11,Admin,You door store.,Low,2024-03-24,Active,2023-11-14,Manager,"['rest', 'certain', 'how']",False,Enterprise,9
12,User,Vote hour fear individual guy later hospital management.,Medium,2024-03-26,Suspended,2021-09-03,Buyer,"['science', 'meeting', 'write']",True,Enterprise,6
13,Admin,Bill despite dinner wind yourself early today amount.,High,2024-08-05,Inactive,2020-08-24,Buyer,"['them', 'under', 'road']",True,Premium,10
14,Guest,Enjoy some fill conference pressure event wonder.,Low,2024-07-11,Inactive,2023-08-07,Seller,"['market', 'discussion', 'color']",True,Enterprise,5
15,User,Late camera can near event catch.,Medium,2024-07-23,Active,2023-03-17,Seller,"['thank', 'class', 'finally']",False,Premium,3
16,Guest,Support practice receive husband follow final prepare.,Low,2024-04-11,Suspended,2023-09-08,Seller,"['number', 'change', 'share']",True,Enterprise,5
17,Admin,Protect shoulder economy and his career read.,Low,2024-03-08,Active,2020-09-11,Buyer,"['activity', 'attack', 'arrive']",False,Basic,7
18,Guest,Return card mother conference car current color.,Low,2024-04-02,Active,2024-01-21,Manager,"['modern', 'admit', 'agency']",False,Premium,6
19,Admin,Eye mind find yard back size reach.,High,2024-07-15,Active,2022-04-03,Seller,"['would', 'magazine', 'enjoy']",False,Premium,5
20,Admin,North similar kid test customer something.,High,2024-01-13,Active,2022-01-29,Buyer,"['every', 'deal', 'language']",False,Premium,9
21,Guest,Manager note garden its political.,Low,2024-05-15,Inactive,2021-12-10,Buyer,"['get', 'try', 'plant']",True,Basic,6
22,Guest,Week help class but.,High,2024-01-12,Suspended,2021-07-09,Manager,"['serious', 'in', 'suddenly']",False,Premium,1
23,User,Whole son which deep grow really option.,Medium,2024-01-25,Inactive,2023-09-03,Buyer,"['simple', 'coach', 'wear']",True,Enterprise,9
24,Admin,Son no itself agency notice current room better.,Low,2024-03-04,Inactive,2024-05-15,Buyer,"['organization', 'find', 'few']",True,Premium,5
25,User,Position reach half writer notice.,Medium,2024-04-30,Active,2023-04-21,Buyer,"['religious', 'life', 'according']",True,Premium,5
26,User,Position wind two anyone.,Medium,2024-07-12,Inactive,2020-12-14,Buyer,"['impact', 'charge', 'public']",False,Premium,4
27,Guest,Receive possible clear.,Low,2024-04-24,Inactive,2024-05-25,Manager,"['yourself', 'boy', 'minute']",True,Premium,2
28,Admin,Accept field several force Mrs.,Medium,2024-07-27,Active,2023-02-04,Seller,"['color', 'church', 'democratic']",False,Enterprise,7
29,User,Treat identify agent owner.,Medium,2024-03-28,Inactive,2020-12-10,Seller,"['accept', 'prevent', 'president']",True,Premium,6
30,Guest,Born morning body Mr although.,Low,2024-04-04,Active,2023-05-29,Seller,"['which', 'memory', 'now']",False,Basic,7
31,User,Court must know all board.,Medium,2024-01-03,Suspended,2023-07-06,Manager,"['body', 'somebody', 'help']",False,Enterprise,4
32,User,Own gas play subject more.,Medium,2024-04-02,Inactive,2021-07-06,Seller,"['left', 'hand', 'ground']",False,Basic,10
33,Admin,Music work north nature partner charge example.,Low,2024-07-12,Suspended,2020-06-20,Buyer,"['group', 'teacher', 'network']",True,Enterprise,8
34,Guest,Star green space appear fire talk.,High,2024-04-24,Inactive,2022-02-17,Seller,"['such', 'point', 'five']",True,Premium,8
35,Admin,Cultural with down lot message.,Low,2024-07-19,Inactive,2020-04-10,Buyer,"['research', 'instead', 'not']",False,Enterprise,3
36,Guest,Hope respond myself manage east.,Medium,2024-07-06,Inactive,2021-04-17,Buyer,"['home', 'use', 'physical']",False,Enterprise,8
37,Guest,Would under perform affect hear he national.,Medium,2024-07-08,Suspended,2021-12-26,Manager,"['market', 'compare', 'foot']",False,Enterprise,1
38,User,Hand movement much culture crime card available PM.,Low,2024-07-19,Suspended,2023-06-02,Manager,"['what', 'may', 'billion']",True,Basic,4
39,Guest,Set far game new.,Low,2024-07-31,Inactive,2020-06-20,Buyer,"['hotel', 'use', 'while']",True,Enterprise,7
40,User,Evening garden north.,Medium,2024-05-24,Active,2021-08-29,Buyer,"['hard', 'throw', 'green']",True,Premium,4
41,Guest,Old hear record task quickly.,Low,2024-03-17,Suspended,2021-08-26,Manager,"['school', 'some', 'physical']",True,Premium,6
42,User,Address your fine well partner itself research.,Medium,2024-02-16,Suspended,2020-06-23,Manager,"['day', 'treatment', 'media']",True,Premium,1
43,User,Military resource bag in door red.,High,2024-05-09,Inactive,2020-07-07,Seller,"['treat', 'design', 'think']",True,Basic,3
44,User,Only newspaper work media.,Medium,2024-02-24,Inactive,2023-10-14,Seller,"['performance', 'member', 'have']",True,Enterprise,8
45,User,Goal popular both shake spring bank good.,Medium,2024-07-10,Active,2023-08-01,Seller,"['to', 'apply', 'sell']",False,Premium,2
46,User,Arm relationship human may still truth clearly.,High,2024-03-13,Suspended,2020-04-21,Buyer,"['point', 'close', 'true']",True,Premium,2
47,Guest,Name exactly edge guess.,High,2024-06-15,Suspended,2022-02-27,Buyer,"['drive', 'Democrat', 'democratic']",True,Enterprise,3
48,User,Crime hand avoid sound how.,Low,2024-02-17,Inactive,2022-09-29,Seller,"['beyond', 'them', 'sense']",True,Premium,3
49,Admin,Pick cold note accept protect.,Low,2024-04-21,Suspended,2021-10-25,Seller,"['wife', 'herself', 'fish']",False,Basic,10
50,Admin,May attorney arrive training.,Medium,2024-01-30,Suspended,2023-01-03,Seller,"['stock', 'building', 'Republican']",False,Basic,4
51,Admin,Sound performance foreign such court will.,Medium,2024-05-10,Suspended,2021-01-09,Buyer,"['heavy', 'shoulder', 'daughter']",True,Enterprise,3
52,User,Discover series start strategy.,Medium,2024-03-08,Active,2022-06-10,Seller,"['keep', 'son', 'else']",True,Premium,8
53,Guest,Level nothing inside why those.,Low,2024-07-20,Inactive,2021-05-29,Manager,"['spring', 'for', 'professor']",False,Enterprise,7
54,Guest,Third share analysis party song home.,High,2024-06-05,Inactive,2023-07-11,Seller,"['its', 'TV', 'record']",False,Enterprise,3
55,Guest,Personal agree TV fast.,Low,2024-05-05,Inactive,2021-05-26,Manager,"['south', 'prove', 'experience']",True,Enterprise,3
56,User,Point term upon fire trade no.,High,2024-04-05,Active,2024-08-02,Seller,"['man', 'too', 'magazine']",True,Basic,6
57,Guest,Quickly appear including better.,High,2024-07-27,Suspended,2020-07-16,Seller,"['trade', 'individual', 'various']",False,Enterprise,3
58,Guest,You statement sing too morning near.,Medium,2024-08-07,Inactive,2022-11-05,Buyer,"['general', 'enjoy', 'outside']",False,Enterprise,9
59,Guest,Section woman board late.,Low,2024-01-13,Active,2024-02-09,Manager,"['employee', 'artist', 'outside']",True,Premium,5
60,Admin,Heavy several where father much him major.,High,2024-05-03,Inactive,2021-12-23,Seller,"['husband', 'foreign', 'house']",True,Premium,1
61,User,Learn just interesting star education.,High,2024-07-21,Active,2023-08-26,Seller,"['role', 'smile', 'benefit']",False,Premium,8
62,User,Drug manager research quickly interesting trouble.,Low,2024-07-17,Inactive,2024-01-30,Seller,"['draw', 'leave', 'situation']",True,Basic,10
63,Admin,Professional state official marriage.,High,2024-07-23,Inactive,2020-06-07,Buyer,"['certain', 'boy', 'car']",False,Basic,9
64,User,Kitchen husband particular new ever parent now.,High,2024-01-22,Inactive,2022-11-17,Manager,"['nor', 'should', 'here']",False,Enterprise,9
65,Admin,Wrong decide order.,Low,2024-02-23,Active,2023-12-13,Seller,"['including', 'order', 'song']",False,Enterprise,1
66,Guest,Fact school one capital quite score approach.,Medium,2024-05-23,Suspended,2024-02-03,Buyer,"['father', 'myself', 'Mr']",False,Basic,4
67,User,Why attention significant interesting across only.,High,2024-08-09,Inactive,2023-06-06,Seller,"['entire', 'girl', 'event']",False,Basic,8
68,Admin,Forward chair group budget.,High,2024-04-03,Active,2020-03-11,Manager,"['could', 'mean', 'girl']",False,Enterprise,10
69,Guest,Music hair religious manager majority better analysis head.,Medium,2024-01-02,Active,2022-05-26,Manager,"['official', 'edge', 'while']",True,Basic,4
70,Admin,Important weight leg public think.,Low,2024-05-04,Inactive,2021-11-14,Manager,"['member', 'base', 'what']",False,Enterprise,9
71,Admin,To economic also though.,Medium,2024-06-12,Suspended,2020-02-09,Seller,"['above', 'prepare', 'may']",False,Enterprise,5
72,Guest,Citizen his example view that hot.,Low,2024-06-19,Active,2022-09-12,Buyer,"['ready', 'able', 'president']",False,Basic,5
73,Guest,Road least set wind commercial kind fast.,High,2024-07-01,Suspended,2022-02-03,Buyer,"['month', 'I', 'option']",True,Basic,6
74,Admin,Investment coach smile.,Low,2024-08-09,Inactive,2023-02-06,Seller,"['green', 'business', 'everybody']",True,Enterprise,5
75,Guest,Church amount give career effect.,Medium,2024-01-24,Inactive,2021-09-30,Seller,"['improve', 'suggest', 'enough']",True,Enterprise,2
76,User,Seek because machine mean bill identify.,Low,2024-08-03,Suspended,2023-10-11,Seller,"['morning', 'town', 'expect']",False,Premium,8
77,User,Wide bar since decision.,Low,2024-01-26,Active,2022-04-20,Manager,"['we', 'drug', 'seek']",True,Enterprise,8
78,Guest,Role skin son trouble second animal ever.,Low,2024-07-22,Suspended,2021-09-16,Seller,"['often', 'price', 'game']",True,Enterprise,7
79,Admin,Pressure appear understand road position not.,Medium,2024-01-04,Active,2020-09-16,Seller,"['around', 'well', 'star']",False,Premium,5
80,User,Father then draw deal weight.,Low,2024-02-06,Suspended,2021-12-14,Buyer,"['them', 'possible', 'area']",False,Premium,1
81,Admin,Pressure agent event.,High,2024-07-25,Suspended,2021-11-02,Seller,"['there', 'artist', 'single']",True,Basic,3
82,User,Seek center name explain political heart hard.,Medium,2024-02-14,Active,2020-04-21,Seller,"['kid', 'mission', 'staff']",True,Enterprise,3
83,Guest,Daughter growth alone final brother still check.,Medium,2024-07-07,Active,2022-08-13,Seller,"['like', 'reflect', 'nothing']",True,Enterprise,6
84,User,Top opportunity his.,High,2024-07-03,Inactive,2020-09-30,Manager,"['movie', 'authority', 'general']",True,Basic,7
85,Guest,First form bag toward situation use.,Medium,2024-06-13,Suspended,2022-06-11,Manager,"['last', 'many', 'reason']",True,Premium,2
86,Guest,Really seek identify give still guess both reach.,High,2024-02-15,Active,2021-01-31,Buyer,"['black', 'ok', 'question']",False,Basic,3
87,Guest,Should result term experience I population since.,High,2024-05-22,Suspended,2022-02-03,Manager,"['trouble', 'throughout', 'street']",False,Basic,1
88,Guest,Actually time study.,Medium,2024-07-18,Active,2024-06-26,Seller,"['traditional', 'during', 'radio']",True,Premium,2
89,Admin,Father set prove up community free baby.,Medium,2024-06-07,Active,2023-08-08,Manager,"['we', 'usually', 'your']",True,Basic,6
90,User,Whether increase official free blue speech far television.,Medium,2024-05-13,Active,2022-08-24,Seller,"['someone', 'conference', 'hear']",True,Enterprise,3
91,Admin,Project have however language.,Low,2024-03-12,Suspended,2023-07-27,Buyer,"['already', 'position', 'even']",True,Premium,6
92,Guest,Pull Democrat reach evening nation key.,High,2024-07-01,Suspended,2021-09-14,Manager,"['live', 'perform', 'seat']",True,Premium,10
93,Guest,Follow degree bar reach cover bag carry interview.,Medium,2024-05-30,Active,2022-01-17,Buyer,"['south', 'lose', 'step']",True,Basic,2
94,Guest,Best south section three.,Low,2024-04-14,Inactive,2022-07-16,Seller,"['clear', 'its', 'dream']",False,Premium,3
95,Admin,Official organization item move many.,Medium,2024-01-11,Suspended,2023-12-31,Buyer,"['and', 'huge', 'step']",True,Enterprise,10
96,Guest,Middle cause face western information they anyone keep.,Low,2024-02-03,Suspended,2021-02-15,Seller,"['himself', 'case', 'north']",True,Enterprise,5
97,Admin,Kid look value career onto Mrs.,Low,2024-02-11,Suspended,2020-12-12,Manager,"['note', 'spend', 'road']",True,Enterprise,7
98,User,In mouth court catch machine school yeah beat.,Low,2024-03-18,Active,2020-08-14,Buyer,"['build', 'civil', 'account']",False,Premium,2
99,Admin,Hit best camera your laugh.,Medium,2024-05-24,Suspended,2021-09-08,Manager,"['ago', 'same', 'interview']",True,Enterprise,1
100,User,Talk choose say career wind.,Medium,2024-01-04,Active,2020-05-16,Seller,"['source', 'probably', 'article']",False,Premium,9
101,Guest,About car fact color meeting answer.,High,2024-02-17,Inactive,2023-08-27,Buyer,"['suffer', 'involve', 'including']",True,Enterprise,2
102,Admin,Keep rate send four performance name happy.,Medium,2024-02-06,Active,2023-03-22,Buyer,"['everything', 'understand', 'social']",True,Premium,9
103,User,Save century special foreign including.,Low,2024-01-12,Suspended,2021-05-12,Manager,"['physical', 'hold', 'analysis']",False,Premium,7
104,Admin,Player return management plan most boy.,Low,2024-06-26,Suspended,2022-11-05,Manager,"['relate', 'use', 'begin']",True,Premium,2
105,User,Interview explain talk arm yes goal.,High,2024-01-07,Suspended,2024-08-06,Buyer,"['remember', 'avoid', 'race']",True,Enterprise,6
106,User,Born ability read write relationship send begin.,Low,2024-02-09,Suspended,2022-08-03,Manager,"['feeling', 'free', 'or']",True,Premium,7
107,Guest,Suddenly civil claim financial cause degree long.,High,2024-05-24,Active,2024-06-18,Buyer,"['table', 'shoulder', 'think']",True,Premium,2
108,User,Impact see computer management.,Low,2024-03-19,Suspended,2021-09-06,Buyer,"['may', 'positive', 'before']",False,Enterprise,3
109,Admin,Cause can adult play.,High,2024-04-01,Suspended,2021-11-10,Buyer,"['growth', 'statement', 'marriage']",True,Basic,8
110,User,Current early window stock song.,Low,2024-07-30,Suspended,2023-01-12,Manager,"['skin', 'teach', 'condition']",False,Basic,6
111,Admin,Stock read attention.,Low,2024-03-08,Inactive,2021-04-09,Manager,"['it', 'represent', 'boy']",True,Basic,6
112,User,Company be American quickly.,Medium,2024-05-04,Suspended,2024-04-07,Buyer,"['plan', 'conference', 'rule']",False,Enterprise,10
113,Guest,Man think force all hour fund nation result.,High,2024-05-21,Inactive,2022-03-11,Seller,"['final', 'I', 'put']",False,Basic,8
114,Guest,Too show political now instead child.,High,2024-01-29,Inactive,2020-10-18,Buyer,"['question', 'sign', 'idea']",False,Basic,10
115,Guest,Also medical go weight themselves wear.,Low,2024-03-10,Active,2023-04-27,Buyer,"['action', 'world', 'white']",True,Basic,1
116,Admin,Benefit identify inside bill media situation mind.,High,2024-03-09,Inactive,2022-04-17,Seller,"['various', 'out', 'always']",False,Basic,3
117,Admin,More easy Congress response.,Low,2024-08-05,Suspended,2024-01-24,Manager,"['to', 'crime', 'why']",False,Basic,6
118,Admin,Southern adult similar little Republican.,Medium,2024-04-03,Suspended,2021-07-16,Seller,"['lot', 'president', 'not']",False,Basic,10
119,User,Ten speak fire use situation then.,High,2024-04-13,Suspended,2020-04-30,Manager,"['commercial', 'system', 'century']",True,Basic,4
120,Guest,Happy shoulder charge teach live statement.,High,2024-08-11,Inactive,2022-12-15,Buyer,"['home', 'cup', 'kitchen']",False,Premium,5
121,User,Impact throw true much.,High,2024-05-22,Suspended,2021-12-10,Seller,"['among', 'recognize', 'spring']",True,Premium,4
122,User,Before consumer reduce good suddenly.,Low,2024-07-13,Inactive,2020-08-14,Manager,"['answer', 'experience', 'reflect']",True,Premium,6
123,Guest,Guess season hot always when.,Medium,2024-04-26,Active,2023-08-30,Manager,"['table', 'role', 'visit']",True,Basic,1
124,User,Can after west evening response its truth response.,High,2024-03-04,Active,2021-07-09,Manager,"['past', 'out', 'here']",False,Enterprise,1
125,User,Herself couple sister short space represent course range.,High,2024-08-08,Suspended,2020-11-09,Seller,"['others', 'create', 'bag']",False,Basic,4
126,Guest,Box into section human bad.,High,2024-02-07,Inactive,2020-12-23,Seller,"['short', 'everyone', 'support']",True,Basic,5
127,Admin,Standard quite cover on order.,High,2024-07-07,Active,2023-08-10,Manager,"['participant', 'report', 'nothing']",False,Enterprise,6
128,User,Manager democratic economy.,Low,2024-01-01,Active,2022-11-15,Manager,"['before', 'worker', 'up']",True,Enterprise,3
129,Guest,Rule be here whole debate model.,Medium,2024-06-21,Active,2023-06-06,Manager,"['discussion', 'east', 'attack']",True,Premium,3
130,Admin,East anything production how very rather lawyer.,Medium,2024-07-16,Inactive,2023-10-24,Seller,"['vote', 'toward', 'nothing']",False,Enterprise,6
131,User,Second town easy water foot.,Medium,2024-07-25,Inactive,2021-01-20,Buyer,"['include', 'art', 'also']",True,Basic,3
132,Guest,Single top blue who recent how.,High,2024-02-03,Active,2022-01-12,Buyer,"['more', 'left', 'month']",True,Premium,8
133,User,Situation turn executive.,Medium,2024-03-18,Active,2020-06-13,Manager,"['others', 'administration', 'western']",False,Basic,8
134,User,Product federal lay four last sing until.,Medium,2024-04-17,Inactive,2023-12-10,Buyer,"['authority', 'family', 'cut']",True,Basic,5
135,Guest,Language paper teacher.,Low,2024-07-19,Suspended,2021-12-23,Buyer,"['officer', 'ready', 'white']",True,Premium,3
136,Admin,Pick natural right.,Low,2024-07-26,Active,2020-01-07,Seller,"['impact', 'light', 'whose']",False,Enterprise,1
137,Guest,Set inside you front however.,Medium,2024-03-28,Inactive,2020-01-12,Buyer,"['expert', 'hit', 'study']",True,Premium,8
138,Guest,Commercial relationship city notice trip night season.,Low,2024-02-23,Suspended,2023-12-31,Buyer,"['tree', 'assume', 'without']",True,Premium,2
139,Admin,The all institution in but easy reveal.,High,2024-04-20,Active,2020-09-10,Buyer,"['modern', 'north', 'main']",True,Basic,4
140,User,Financial measure price machine man.,Medium,2024-01-26,Suspended,2022-11-25,Manager,"['pull', 'stay', 'life']",True,Enterprise,10
141,User,Fast budget out serve happen evidence.,High,2024-01-12,Active,2024-03-20,Buyer,"['party', 'reach', 'behavior']",True,Enterprise,8
142,Admin,Number get difference base phone child.,High,2024-01-20,Inactive,2020-09-15,Buyer,"['range', 'computer', 'lay']",True,Premium,1
143,Admin,Police determine name.,Low,2024-08-09,Inactive,2021-05-20,Manager,"['enjoy', 'action', 'sing']",False,Premium,1
144,User,Standard television member.,Low,2024-06-06,Inactive,2023-06-09,Buyer,"['war', 'reveal', 'capital']",False,Basic,3
145,User,Find smile project trouble especially.,Medium,2024-01-27,Inactive,2020-11-08,Buyer,"['ball', 'design', 'future']",True,Enterprise,10
146,Guest,Skill single plan computer trade save.,High,2024-01-24,Suspended,2020-03-24,Seller,"['someone', 'morning', 'stop']",False,Premium,9
147,User,Reality popular fill reveal middle consumer.,High,2024-06-15,Active,2023-02-05,Seller,"['find', 'even', 'admit']",False,Basic,7
148,Admin,Week exist toward whose system let service major.,Low,2024-06-27,Suspended,2023-05-20,Buyer,"['attack', 'him', 'point']",True,Premium,6
149,User,Sort just never line safe provide method discussion.,Low,2024-03-26,Inactive,2020-11-24,Seller,"['girl', 'chair', 'defense']",False,Premium,5
150,Admin,Believe less or various boy son.,High,2024-05-05,Inactive,2024-07-14,Manager,"['yeah', 'opportunity', 'either']",True,Basic,5
151,Admin,Candidate whose tough.,Medium,2024-04-27,Suspended,2020-11-20,Seller,"['floor', 'try', 'ready']",True,Basic,2
152,Admin,Nearly trip century what charge per.,Low,2024-05-10,Active,2021-05-04,Seller,"['agreement', 'eye', 'general']",True,Basic,10
153,User,Building exist occur responsibility role onto.,Medium,2024-04-28,Active,2022-07-31,Buyer,"['middle', 'network', 'no']",True,Enterprise,6
154,Guest,Interest star man society name through.,Low,2024-03-24,Inactive,2021-03-21,Manager,"['agree', 'fund', 'radio']",True,Enterprise,6
155,Guest,Kitchen water standard enough compare role.,Low,2024-02-28,Active,2022-02-09,Manager,"['data', 'station', 'have']",True,Premium,9
156,User,Concern source generation rise vote.,High,2024-03-19,Inactive,2020-05-22,Buyer,"['firm', 'from', 'value']",True,Basic,4
157,Guest,Director network happy almost develop record.,High,2024-04-24,Active,2021-06-30,Manager,"['generation', 'week', 'middle']",False,Basic,6
158,Guest,Writer popular soon will.,High,2024-01-17,Active,2023-02-12,Seller,"['left', 'much', 'society']",True,Premium,1
159,Admin,Leave which social stop Congress decade.,High,2024-07-26,Suspended,2020-02-04,Manager,"['include', 'show', 'fact']",True,Basic,9
160,User,Series actually key remain.,High,2024-03-12,Inactive,2023-12-13,Manager,"['quality', 'our', 'do']",False,Enterprise,2
161,User,Carry accept official bit.,Medium,2024-03-23,Inactive,2020-08-24,Buyer,"['something', 'deep', 'present']",True,Enterprise,7
162,Guest,Tonight participant city part his.,Medium,2024-04-26,Suspended,2021-04-10,Seller,"['recently', 'success', 'especially']",True,Enterprise,9
163,Guest,Board go free take sort impact create.,Low,2024-07-21,Inactive,2020-09-05,Buyer,"['term', 'particularly', 'attack']",True,Premium,5
164,Guest,Make either provide eat budget necessary story conference.,Low,2024-05-22,Inactive,2022-09-29,Buyer,"['example', 'young', 'record']",True,Enterprise,1
165,Guest,Yard behavior couple economic recently.,Low,2024-07-17,Inactive,2021-02-12,Manager,"['tax', 'two', 'scene']",True,Basic,10
166,User,Successful building enter maintain.,Low,2024-07-04,Active,2021-12-19,Manager,"['other', 'smile', 'already']",True,Premium,3
167,User,Amount answer necessary left collection change.,Low,2024-04-13,Active,2020-05-28,Buyer,"['chance', 'edge', 'management']",False,Premium,3
168,Guest,Else near write movie.,High,2024-05-01,Suspended,2021-08-27,Manager,"['new', 'could', 'rest']",False,Premium,1
169,User,Charge character series general political break.,High,2024-03-03,Active,2021-04-08,Manager,"['practice', 'treat', 'bar']",True,Premium,5
170,Admin,A indeed visit.,Low,2024-03-20,Active,2021-06-14,Buyer,"['not', 'may', 'figure']",False,Premium,7
171,Admin,Technology kind service such current yes upon activity.,Medium,2024-06-11,Inactive,2021-09-25,Seller,"['specific', 'certain', 'enough']",False,Enterprise,7
172,Admin,Peace buy sea safe notice let reach someone.,Medium,2024-01-19,Suspended,2023-04-23,Manager,"['finally', 'truth', 'study']",True,Basic,8
173,Admin,Lay nature from under partner guess.,High,2024-03-12,Inactive,2023-04-30,Buyer,"['remember', 'avoid', 'interview']",False,Premium,2
174,Admin,Choose community decide ever visit anyone collection.,Medium,2024-06-26,Active,2023-05-03,Seller,"['because', 'traditional', 'far']",True,Enterprise,2
175,Guest,Rock usually seem space save energy hard.,High,2024-04-11,Inactive,2023-10-11,Manager,"['require', 'task', 'way']",False,Enterprise,1
176,User,Draw plan general election buy.,Low,2024-05-25,Active,2020-12-04,Manager,"['moment', 'break', 'development']",False,Basic,1
177,Admin,Quickly even focus government home hair never.,Medium,2024-07-21,Active,2022-07-22,Buyer,"['PM', 'compare', 'truth']",False,Enterprise,9
178,Guest,Citizen much wide interesting provide.,Low,2024-02-22,Suspended,2020-07-21,Seller,"['produce', 'whole', 'include']",False,Premium,4
179,Admin,Develop material above plan man admit cut.,High,2024-03-31,Inactive,2022-02-11,Manager,"['suggest', 'often', 'reason']",False,Basic,1
180,User,Worry someone thought sometimes off very address.,High,2024-06-25,Inactive,2021-06-15,Buyer,"['vote', 'his', 'computer']",False,Enterprise,10
181,User,Fast day land hot what.,High,2024-01-31,Active,2021-11-25,Buyer,"['also', 'traditional', 'executive']",True,Basic,5
182,Admin,Two situation me apply spend change majority.,Medium,2024-07-23,Active,2022-06-05,Seller,"['dream', 'daughter', 'year']",False,Premium,8
183,Guest,Sister practice hundred suggest.,Medium,2024-06-29,Active,2023-04-22,Manager,"['long', 'phone', 'remain']",False,Basic,6
184,User,Stock at relationship marriage heart significant.,Medium,2024-03-19,Active,2023-04-26,Seller,"['during', 'win', 'long']",True,Premium,8
185,User,Response party month get indicate human.,Medium,2024-01-17,Active,2020-04-11,Seller,"['through', 'main', 'have']",True,Basic,2
186,Admin,Test major four five born.,Low,2024-06-03,Inactive,2022-11-12,Manager,"['cause', 'news', 'way']",False,Enterprise,4
